{
  "schemaVersion": "kontextstack-guide/v1",
  "module": {
    "name": "node-cpanel",
    "version": "0.4.1"
  },
  "package": {
    "name": "kontextstack",
    "version": "0.6.0-alpha.2"
  },
  "title": "Add or adapt a cPanel Node runtime",
  "summary": "Source-traced Node startup, routing, environment, provider and recovery implementation kit.",
  "durationMinutes": {
    "min": 30,
    "max": 120
  },
  "maturity": [
    1,
    2,
    3
  ],
  "prerequisites": [],
  "questions": [
    {
      "id": "adaptation",
      "prompt": "Which runtime adaptation is appropriate?",
      "answer": {
        "type": "choice",
        "options": [
          "existing-framework",
          "greenfield-node-http"
        ]
      },
      "evidencePolicy": "non-secret-only"
    },
    {
      "id": "proxy",
      "prompt": "What proxy trust is proven?",
      "answer": {
        "type": "choice",
        "options": [
          "disabled",
          "separately-reviewed-framework-adapter"
        ]
      },
      "evidencePolicy": "non-secret-only"
    },
    {
      "id": "data",
      "prompt": "Does this runtime require durable storage or identity?",
      "answer": {
        "type": "choice",
        "options": [
          "neither",
          "storage-only",
          "storage-and-identity"
        ]
      },
      "evidencePolicy": "non-secret-only"
    }
  ],
  "stages": [
    {
      "id": "goal",
      "title": "Confirm the goal",
      "kind": "inspect",
      "approval": "none",
      "instructions": [
        "Read the capability boundary and exclude unneeded services."
      ],
      "completionEvidence": [
        "Recorded selected goal and exclusions."
      ]
    },
    {
      "id": "inspect",
      "title": "Inspect the actual project",
      "kind": "inspect",
      "approval": "none",
      "instructions": [
        "Collect required project evidence without revealing values."
      ],
      "completionEvidence": [
        "Confirmed facts and missing evidence."
      ]
    },
    {
      "id": "findings",
      "title": "Review findings",
      "kind": "decide",
      "approval": "none",
      "instructions": [
        "Separate facts, gaps, conflicts and recommendation conditions."
      ],
      "completionEvidence": [
        "Reviewed evidence and invalidation conditions."
      ]
    },
    {
      "id": "architecture",
      "title": "Choose architecture",
      "kind": "decide",
      "approval": "none",
      "instructions": [
        "Record owner choices from the module decision contract."
      ],
      "completionEvidence": [
        "Project-owned decision references."
      ]
    },
    {
      "id": "install",
      "title": "Install the kit",
      "kind": "install",
      "approval": "exact-preview",
      "instructions": [
        "Inspect, preview, approve exact identifier, apply and verify."
      ],
      "completionEvidence": [
        "Local module verification result."
      ]
    },
    {
      "id": "implement",
      "title": "Continue with Codex",
      "kind": "implement",
      "approval": "none",
      "instructions": [
        "Read CODEX_PROMPT.md and adapt reviewed references."
      ],
      "completionEvidence": [
        "Project changes and local check results."
      ]
    },
    {
      "id": "local",
      "title": "Verify locally",
      "kind": "verify-local",
      "approval": "none",
      "instructions": [
        "Execute the project's reviewed checks and inspect the artifact."
      ],
      "completionEvidence": [
        "Non-secret local results or explicit gaps."
      ]
    },
    {
      "id": "prepare-provider",
      "title": "Prepare the provider",
      "kind": "provider",
      "approval": "separate-explicit-approval",
      "instructions": [
        "Record exact target, owner, effect, expected result, recovery and approval."
      ],
      "completionEvidence": [
        "Explicit scoped approval or deferred provider work."
      ]
    },
    {
      "id": "provider",
      "title": "Apply the approved external change",
      "kind": "provider",
      "approval": "separate-explicit-approval",
      "instructions": [
        "Use PROVIDER_SETUP.md only within current explicit authority."
      ],
      "completionEvidence": [
        "Sanitized provider outcome and verification."
      ]
    },
    {
      "id": "accept",
      "title": "Verify and accept",
      "kind": "accept",
      "approval": "separate-explicit-approval",
      "instructions": [
        "Verify production and rollback readiness; request owner acceptance."
      ],
      "completionEvidence": [
        "Observed results and explicit owner decision."
      ]
    }
  ],
  "commands": [
    {
      "id": "inspect",
      "stage": "install",
      "text": "kontextstack modules inspect --module node-cpanel --version 0.4.1 --project <PROJECT_PATH>",
      "execution": "copy-only",
      "placeholders": [
        "<PROJECT_PATH>"
      ]
    },
    {
      "id": "preview",
      "stage": "install",
      "text": "kontextstack modules preview --module node-cpanel --version 0.4.1 --project <PROJECT_PATH>",
      "execution": "copy-only",
      "placeholders": [
        "<PROJECT_PATH>"
      ]
    },
    {
      "id": "apply",
      "stage": "install",
      "text": "kontextstack modules apply --module node-cpanel --version 0.4.1 --project <PROJECT_PATH> --approve <PREVIEW_ID>",
      "execution": "copy-only",
      "placeholders": [
        "<PROJECT_PATH>",
        "<PREVIEW_ID>"
      ]
    },
    {
      "id": "verify",
      "stage": "install",
      "text": "kontextstack modules verify --project <PROJECT_PATH>",
      "execution": "copy-only",
      "placeholders": [
        "<PROJECT_PATH>"
      ]
    }
  ],
  "documents": {
    "start": "docs/kontextstack/modules/node-cpanel/START_HERE.md",
    "implementation": "docs/kontextstack/modules/node-cpanel/IMPLEMENTATION.md",
    "provider": "docs/kontextstack/modules/node-cpanel/PROVIDER_SETUP.md",
    "verification": "docs/kontextstack/modules/node-cpanel/VERIFICATION.md",
    "rollback": "docs/kontextstack/modules/node-cpanel/ROLLBACK.md",
    "codex": "docs/kontextstack/modules/node-cpanel/CODEX_PROMPT.md"
  },
  "completion": {
    "evidencePolicy": "non-secret-or-explicit-waiver",
    "states": [
      "installed",
      "implemented",
      "locally-verified",
      "provider-configured",
      "deployed",
      "migrated",
      "production-verified",
      "owner-accepted"
    ],
    "progressGrantsAuthority": false
  },
  "redaction": {
    "policy": "never-print-or-copy-values",
    "prohibited": [
      "tokens",
      "passwords",
      "env-values",
      "private-keys",
      "customer-data",
      "production-rows",
      "unreviewed-screenshots"
    ]
  },
  "source": {
    "repository": "https://github.com/dondsp/kontextstack",
    "commit": "0a62317c176de98193f67a4c1df5267db020525b",
    "implementationIntegrity": "sha256-8647c76a078ed2dad1361a3e8b637cafad45fec57a27c2f8e8b4d0ee96afb220",
    "integrity": "sha256-84610c9aefe247bec8cdd0bad59d9b58053f58a52257ae6e40c57084d57287e4"
  }
}
