{
  "schemaVersion": "kontextstack-guide/v1",
  "module": {
    "name": "auth-local",
    "version": "0.5.0"
  },
  "package": {
    "name": "kontextstack",
    "version": "0.6.0-alpha.2"
  },
  "title": "Add durable local authentication",
  "summary": "Add durable local authentication with source-traced implementation, verification and recovery.",
  "durationMinutes": {
    "min": 30,
    "max": 120
  },
  "maturity": [
    2,
    3
  ],
  "prerequisites": [],
  "questions": [
    {
      "id": "storage",
      "prompt": "Which storage mode is approved?",
      "answer": {
        "type": "choice",
        "options": [
          "mysql-production",
          "memory-local-test-only"
        ]
      },
      "evidencePolicy": "non-secret-only"
    },
    {
      "id": "registration",
      "prompt": "May unauthenticated visitors register?",
      "answer": {
        "type": "choice",
        "options": [
          "closed",
          "open"
        ]
      },
      "evidencePolicy": "non-secret-only"
    },
    {
      "id": "authorization",
      "prompt": "Which server authorization rules apply?",
      "answer": {
        "type": "choice",
        "options": [
          "deny-by-default-self-and-admin",
          "review-existing-policy"
        ]
      },
      "evidencePolicy": "non-secret-only"
    }
  ],
  "stages": [
    {
      "id": "goal",
      "title": "Confirm the goal",
      "kind": "inspect",
      "approval": "none",
      "instructions": [
        "Read the capability boundary and exclude unneeded services."
      ],
      "completionEvidence": [
        "Recorded selected goal and exclusions."
      ]
    },
    {
      "id": "inspect",
      "title": "Inspect the actual project",
      "kind": "inspect",
      "approval": "none",
      "instructions": [
        "Collect required project evidence without revealing values."
      ],
      "completionEvidence": [
        "Confirmed facts and missing evidence."
      ]
    },
    {
      "id": "findings",
      "title": "Review findings",
      "kind": "decide",
      "approval": "none",
      "instructions": [
        "Separate facts, gaps, conflicts and recommendation conditions."
      ],
      "completionEvidence": [
        "Reviewed evidence and invalidation conditions."
      ]
    },
    {
      "id": "architecture",
      "title": "Choose architecture",
      "kind": "decide",
      "approval": "none",
      "instructions": [
        "Record owner choices from the module decision contract."
      ],
      "completionEvidence": [
        "Project-owned decision references."
      ]
    },
    {
      "id": "install",
      "title": "Install the kit",
      "kind": "install",
      "approval": "exact-preview",
      "instructions": [
        "Inspect, preview, approve exact identifier, apply and verify."
      ],
      "completionEvidence": [
        "Local module verification result."
      ]
    },
    {
      "id": "implement",
      "title": "Continue with Codex",
      "kind": "implement",
      "approval": "none",
      "instructions": [
        "Read CODEX_PROMPT.md and adapt reviewed references."
      ],
      "completionEvidence": [
        "Project changes and local check results."
      ]
    },
    {
      "id": "local",
      "title": "Verify locally",
      "kind": "verify-local",
      "approval": "none",
      "instructions": [
        "Execute the project's reviewed checks and inspect the artifact."
      ],
      "completionEvidence": [
        "Non-secret local results or explicit gaps."
      ]
    },
    {
      "id": "prepare-provider",
      "title": "Prepare the provider",
      "kind": "provider",
      "approval": "separate-explicit-approval",
      "instructions": [
        "Record exact target, owner, effect, expected result, recovery and approval."
      ],
      "completionEvidence": [
        "Explicit scoped approval or deferred provider work."
      ]
    },
    {
      "id": "provider",
      "title": "Apply the approved external change",
      "kind": "provider",
      "approval": "separate-explicit-approval",
      "instructions": [
        "Use PROVIDER_SETUP.md only within current explicit authority."
      ],
      "completionEvidence": [
        "Sanitized provider outcome and verification."
      ]
    },
    {
      "id": "accept",
      "title": "Verify and accept",
      "kind": "accept",
      "approval": "separate-explicit-approval",
      "instructions": [
        "Verify production and rollback readiness; request owner acceptance."
      ],
      "completionEvidence": [
        "Observed results and explicit owner decision."
      ]
    }
  ],
  "commands": [
    {
      "id": "inspect",
      "stage": "install",
      "text": "kontextstack modules inspect --module auth-local --version 0.5.0 --project <PROJECT_PATH>",
      "execution": "copy-only",
      "placeholders": [
        "<PROJECT_PATH>"
      ]
    },
    {
      "id": "preview",
      "stage": "install",
      "text": "kontextstack modules preview --module auth-local --version 0.5.0 --project <PROJECT_PATH>",
      "execution": "copy-only",
      "placeholders": [
        "<PROJECT_PATH>"
      ]
    },
    {
      "id": "apply",
      "stage": "install",
      "text": "kontextstack modules apply --module auth-local --version 0.5.0 --project <PROJECT_PATH> --approve <PREVIEW_ID>",
      "execution": "copy-only",
      "placeholders": [
        "<PROJECT_PATH>",
        "<PREVIEW_ID>"
      ]
    },
    {
      "id": "verify",
      "stage": "install",
      "text": "kontextstack modules verify --project <PROJECT_PATH>",
      "execution": "copy-only",
      "placeholders": [
        "<PROJECT_PATH>"
      ]
    }
  ],
  "documents": {
    "start": "docs/kontextstack/modules/auth-local/START_HERE.md",
    "implementation": "docs/kontextstack/modules/auth-local/IMPLEMENTATION.md",
    "provider": "docs/kontextstack/modules/auth-local/PROVIDER_SETUP.md",
    "verification": "docs/kontextstack/modules/auth-local/VERIFICATION.md",
    "rollback": "docs/kontextstack/modules/auth-local/ROLLBACK.md",
    "codex": "docs/kontextstack/modules/auth-local/CODEX_PROMPT.md"
  },
  "completion": {
    "evidencePolicy": "non-secret-or-explicit-waiver",
    "states": [
      "installed",
      "implemented",
      "locally-verified",
      "provider-configured",
      "deployed",
      "migrated",
      "production-verified",
      "owner-accepted"
    ],
    "progressGrantsAuthority": false
  },
  "redaction": {
    "policy": "never-print-or-copy-values",
    "prohibited": [
      "tokens",
      "passwords",
      "env-values",
      "private-keys",
      "customer-data",
      "production-rows",
      "unreviewed-screenshots"
    ]
  },
  "source": {
    "repository": "https://github.com/dondsp/kontextstack",
    "commit": "0a62317c176de98193f67a4c1df5267db020525b",
    "implementationIntegrity": "sha256-ebd18bdccbaf1471e0286ea36ed42a6dfc9ced3e91bc7dbdeeca22446c80e846",
    "integrity": "sha256-ac436125b361910d7661966983e6cab88acc58436aba4a1badc24b6c206f90ff"
  }
}
